{
  "$schema": "http://json-schema.org/schema#",
  "title": "Schema title",
  "description": "Schema description",
  "type": "object",
  "properties": {
    "_id": {
      "type": "string"
    },
    "name": {
      "type": "string"
    },
    "year": {
      "type": "number"
    },
    "rating": {
      "type": "string"
    },
    "runtime": {
      "type": "number"
    },
    "genre": {
      "type": "string"
    },
    "earnings_rank": {
      "type": "number"
    },
    "actors": {
      "type": "array",
      "items": [
        {
          "type": "object",
          "properties": {
            "id": {
              "type": "string"
            },
            "name": {
              "type": "string"
            }
          }
        },
        {
          "type": "object",
          "properties": {
            "id": {
              "type": "string"
            },
            "name": {
              "type": "string"
            }
          }
        },
        {
          "type": "object",
          "properties": {
            "id": {
              "type": "string"
            },
            "name": {
              "type": "string"
            }
          }
        },
        {
          "type": "object",
          "properties": {
            "id": {
              "type": "string"
            },
            "name": {
              "type": "string"
            }
          }
        },
        {
          "type": "object",
          "properties": {
            "id": {
              "type": "string"
            },
            "name": {
              "type": "string"
            }
          }
        }
      ]
    },
    "directors": {
      "type": "array",
      "items": {
        "type": "object",
        "properties": {
          "id": {
            "type": "string"
          },
          "name": {
            "type": "string"
          }
        }
      }
    }
  }
}
